{
  "schema_version": "irb-context-record/1.0",
  "context_record_id": "fixture.missing-data-axis",
  "confirmed_by": "author",
  "confirmed_at": "2026-08-09T10:00:00+08:00",
  "applicability_as_of": "2026-08-09",
  "scope_dimensions": {
    "review_jurisdictions": ["support.us_hhs_or_common_rule"],
    "institutions": [],
    "data_protection_regimes": ["scope.eu_gdpr"],
    "funders": [],
    "study_types": ["activity.human_subjects"],
    "populations": [],
    "data_locations": ["processing.personal_data"],
    "cross_border_transfers": []
  },
  "declared_facts": [
    {"fact_id": "activity.human_subjects", "value_type": "boolean", "state": "declared", "value": true, "provenance": "author_declared"},
    {"fact_id": "support.us_hhs_or_common_rule", "value_type": "boolean", "state": "declared", "value": true, "provenance": "author_declared"},
    {"fact_id": "scope.eu_gdpr", "value_type": "boolean", "state": "declared", "value": true, "provenance": "author_declared"},
    {"fact_id": "processing.personal_data", "value_type": "boolean", "state": "declared", "value": true, "provenance": "author_declared"}
  ],
  "profile_selection_state": {"review_ethics": "selected", "data_protection": "unresolved"},
  "selected_profiles": [
    {
      "axis": "review_ethics",
      "profile_id": "us.hhs.45-cfr-46.subpart-a",
      "profile_version": "2019-01-21",
      "profile_digest": "46fd0b39b1ca1706363e1163c2b4a1149bb2ff22fc2f64c5426fc3ec8b6b0fd4",
      "authority_scope_ids": ["us.common-rule"]
    }
  ],
  "overlay_selection_state": {"institutional": "none_declared_by_author", "funder": "none_declared_by_author"},
  "selected_overlays": [],
  "display_precedence": [
    {
      "axis": "review_ethics",
      "purpose": "display_only_no_suppression",
      "ordered_authorities": [
        {"authority_kind": "profile", "axis": "review_ethics", "authority_id": "us.hhs.45-cfr-46.subpart-a", "authority_version": "2019-01-21", "authority_digest": "46fd0b39b1ca1706363e1163c2b4a1149bb2ff22fc2f64c5426fc3ec8b6b0fd4"}
      ]
    },
    {"axis": "data_protection", "purpose": "display_only_no_suppression", "ordered_authorities": []}
  ]
}
